{
  "protocol_version": "0.3",
  "organization": {
    "name": "Demo Toyota",
    "domain": "demo-toyota.example.com"
  },
  "web": {},
  "extensions": {
    "autoagentprotocol.org/aap": {
      "version": "1",
      "agent_card": "https://demo-toyota.example.com/.well-known/agent-card.json",
      "documentation": "https://autoagentprotocol.org/"
    }
  }
}
